file_name	text
Brendan-Budok_Durand-Le-Ludec/ccf0497c74f6f47ea79caea9a105e694_0351934_0357148.mp3	Amañ setu ez eus euh daou baotr, yaouankoc'h, ha n'int ket ken bras,
Brendan-Budok_Durand-Le-Ludec/ccf0497c74f6f47ea79caea9a105e694_0357149_0364160.mp3	Met o deus euh… o deus gourenet brav ivez, ar re zu o deus tapet ar maout aze er gouren.
Brendan-Budok_Durand-Le-Ludec/ccf0497c74f6f47ea79caea9a105e694_0364500_0367865.mp3	Ha siwazh n'o doa ket bet amzer achuiñ ar bartienn-mañ…
Brendan-Budok_Durand-Le-Ludec/ccf0497c74f6f47ea79caea9a105e694_0367866_0377574.mp3	Met tenn-tre oa aze, ha neuze em boa… m'oa roet ar splet aze d'ar re zu, setu oa bet rampo etrezo.
Brendan-Budok_Durand-Le-Ludec/ccf0497c74f6f47ea79caea9a105e694_0378000_0387120.mp3	Boñ, emichañs en deus plijet deoc'h gwelet-se, ha kement hag ober un tamm bruderezh d'ar GBB, hag emichañs hon do tro d'ober abadennoù euh echedoù back-hold, chess back-hold, gwechoù all c'hoazh.
Brendan-Budok_Durand-Le-Ludec/ccf0497c74f6f47ea79caea9a105e694_0387420_0388810.mp3	Kenavo ar c'hentañ tro !
Neus_Ket_Deus_Archoazh/c50a32c62dacaf1e613dc5f1b99107f9_0048000_0052290.mp3	Sell aze an Douar, evel ma oa dek milion vloaz ha pevar-ugent zo.
Neus_Ket_Deus_Archoazh/c50a32c62dacaf1e613dc5f1b99107f9_0053460_0055980.mp3	"Kleizeg uhel" a vez graet deus ar marevezh-se.
Neus_Ket_Deus_Archoazh/c50a32c62dacaf1e613dc5f1b99107f9_0056670_0061110.mp3	Tommadur bras-bras oa war an Douar, hag an dinosaored oa rouaned ar blanedenn.
Neus_Ket_Deus_Archoazh/c50a32c62dacaf1e613dc5f1b99107f9_0061920_0065910.mp3	Bevañ a raent trankilik, en o flas uhelañ e chadenn ar boued.
Neus_Ket_Deus_Archoazh/c50a32c62dacaf1e613dc5f1b99107f9_0066540_0069960.mp3	Ne ouient ket oa cheñchamantoù bras o c'hoarvez tro-dro dezho.
Neus_Ket_Deus_Archoazh/c50a32c62dacaf1e613dc5f1b99107f9_0070350_0079859.mp3	O pellaat an eil deus egile oa ar c'hevandirioù, en ur zigeriñ frailhoù bras e pluskenn an Douar, bet beuzet goude gant an dour hag aet da vorioù.
Neus_Ket_Deus_Archoazh/c50a32c62dacaf1e613dc5f1b99107f9_0079859_0084510.mp3	O strujañ veze ar bezhin, da heul an tommder bras-bras, hag o kontammiñ an dour.
Neus_Ket_Deus_Archoazh/c50a32c62dacaf1e613dc5f1b99107f9_0084840_0088890.mp3	Marvet oant goude, ha kouezhet, miliardoù anezho, e foñs ar frailhoù.
Neus_Ket_Deus_Archoazh/c50a32c62dacaf1e613dc5f1b99107f9_0092010_0096720.mp3	Kaset oa bet ar oueledenn d'ar morioù, betek ma oa bet peurc'holoet lostachoù ar bezhin.
Neus_Ket_Deus_Archoazh/c50a32c62dacaf1e613dc5f1b99107f9_0097380_0107070.mp3	Kresket he doa ar wask, hag an tommder ivez, ha dre gimiezh oa bet treuzfurmet al lostachoù e hidrokarbidennoù : tireoul ha gaz.
Neus_Ket_Deus_Archoazh/c50a32c62dacaf1e613dc5f1b99107f9_0109470_0112980.mp3	Kemend-all oa c'hoarvezet war an douar, ha deut glaou da heul.
Neus_Ket_Deus_Archoazh/c50a32c62dacaf1e613dc5f1b99107f9_0114360_0121198.mp3	Ur pemp milion vloavezh zo bet ezhomm d'an natur evit aozañ an energiezhioù fosil lonket gant an dud e-korf ur bloavezh.
Neus_Ket_Deus_Archoazh/c50a32c62dacaf1e613dc5f1b99107f9_0121800_0129389.mp3	Stag eo hon doare da vevañ hiziv deus an nerzhioù fosil-se, ha pa vefe souezh gwelet pet a dud a ra evel ma vijent difin.
Neus_Ket_Deus_Archoazh/c50a32c62dacaf1e613dc5f1b99107f9_0132150_0136860.mp3	Abaoe triwec'h kant tri-ugent zo bet eztennet daou vil viliard barrikennad tireoul.
Neus_Ket_Deus_Archoazh/c50a32c62dacaf1e613dc5f1b99107f9_0139350_0141870.mp3	Betek-henn zo bet lonket un hanter anezho, well-wazh.
Neus_Ket_Deus_Archoazh/c50a32c62dacaf1e613dc5f1b99107f9_0145263_0148230.mp3	A-raok tennañ tireoul deus an douar vez ret kavet anezhañ.
Neus_Ket_Deus_Archoazh/c50a32c62dacaf1e613dc5f1b99107f9_0148980_0151904.mp3	Da zigentañ oa aes da gavet ha marc'had mat da eztennañ.
Neus_Ket_Deus_Archoazh/c50a32c62dacaf1e613dc5f1b99107f9_0152730_0157770.mp3	Spindletop oa kentañ tireouleg vras Amerika, bet diskuliet e naontek kant.
Neus_Ket_Deus_Archoazh/c50a32c62dacaf1e613dc5f1b99107f9_0158100_0159240.mp3	Ur bern oa bet da heul.
Neus_Ket_Deus_Archoazh/c50a32c62dacaf1e613dc5f1b99107f9_0160470_0165780.mp3	Furchet veze Amerika gant an douarourien, o doa kavet bernioù bras a eoul, gaz ha glaou.
Neus_Ket_Deus_Archoazh/c50a32c62dacaf1e613dc5f1b99107f9_0166680_0170910.mp3	Muioc'h a direoul veze eztennet en Amerika evit e n'eus forzh peseurt bro all.
Neus_Ket_Deus_Archoazh/c50a32c62dacaf1e613dc5f1b99107f9_0171450_0173730.mp3	Hag ur vro dreist-galloudus e oa deut da vezañ.
Neus_Ket_Deus_Archoazh/c50a32c62dacaf1e613dc5f1b99107f9_0175110_0180750.mp3	Pa groger da broduiñ tireoul en ur puñs n'eo ken nemet un afer amzer a-raok ma'h afe ar produiñ war ziskar.
Neus_Ket_Deus_Archoazh/c50a32c62dacaf1e613dc5f1b99107f9_0181590_0183630.mp3	Disheñvel eo live produiñ pep puñs.
Neus_Ket_Deus_Archoazh/c50a32c62dacaf1e613dc5f1b99107f9_0184140_0189240.mp3	Pa saver ur geidenn deus produiñ an holl buñsoù e treser ur grommenn stumm ur c'hloc'h dezhi.
Neus_Ket_Deus_Archoazh/c50a32c62dacaf1e613dc5f1b99107f9_0190200_0195870.mp3	Peurvuiañ vez ezhomm deus daou-ugent vloaz goude ar penn-diskuliadenn evit ma tizhfe ur vro ur pikern er produiñ.
Neus_Ket_Deus_Archoazh/c50a32c62dacaf1e613dc5f1b99107f9_0196412_0198960.mp3	Goude-se eh a ar produiñ war-ziskar, dre ret.
Neus_Ket_Deus_Archoazh/c50a32c62dacaf1e613dc5f1b99107f9_0200370_0207330.mp3	Er bloavezhioù hanter-kant, oa bet jedet gant Marion King Hubbert, douar-fizikour a laboure evit Shell, e vefe pikern produiñ tireoul Amerika
Neus_Ket_Deus_Archoazh/c50a32c62dacaf1e613dc5f1b99107f9_0207420_0214470.mp3	e naontek kant dek ha tri-ugent, daou-ugent vloaz goude pikern diskuliañ an tireoul en Amerika. Oa ket bet kredet anezhañ.
Neus_Ket_Deus_Archoazh/c50a32c62dacaf1e613dc5f1b99107f9_0214080_0219930.mp3	Padal, e naontek kant dek ha tri-ugent oa bet ar pikern produiñ tireoul en Amerika ha krog an diskar da heul.
Neus_Ket_Deus_Archoazh/c50a32c62dacaf1e613dc5f1b99107f9_0221220_0229469.mp3	Ar wirionez oa gant Hubbert. Adalek ar mare-se, eo bet ret d'an Amerikaned enporzhiañ muioc'h-mui a direoul.
Neus_Ket_Deus_Archoazh/c50a32c62dacaf1e613dc5f1b99107f9_0230010_0234779.mp3	Dalc'het int bet gant ur pourveziñ dizingal ha paket gant an enkadennoù ekonomikel deut da heul,
Neus_Ket_Deus_Archoazh/c50a32c62dacaf1e613dc5f1b99107f9_0235080_0239820.mp3	stroñsoù an tireoul e naontek kant trizek ha tri-ugent ha naontek kant naontek ha tri-ugent.
Neus_Ket_Deus_Archoazh/c50a32c62dacaf1e613dc5f1b99107f9_0240870_0244950.mp3	Er bloavezhioù tregont eo oa bet kavet ar muiañ a direoulegoù en istor Amerika.
Neus_Ket_Deus_Archoazh/c50a32c62dacaf1e613dc5f1b99107f9_0245730_0250950.mp3	Daoust d'an teknologiezhioù nevez eo aet an diskuliañ tireoulegoù nevez war zigreskiñ ingal.
Neus_Ket_Deus_Archoazh/c50a32c62dacaf1e613dc5f1b99107f9_0254040_0259529.mp3	Ar re nevez kavet, evel ANWAR, da skouer, a rofe tireoul evit seitek miz, d'ar muiañ.
Neus_Ket_Deus_Archoazh/c50a32c62dacaf1e613dc5f1b99107f9_0260820_0267750.mp3	Memes an tireouleg Jack-daou, e pleg-mor Mec'hiko, ne bourvezfe ket an tier, en Amerika, en tu all d'un nebeud mizioù.
Neus_Ket_Deus_Archoazh/c50a32c62dacaf1e613dc5f1b99107f9_0268770_0273810.mp3	Ha pa vefe bras, n'eus tireouleg ebet a vefe trawalc'h evit respont da ezhommoù Amerika.
Neus_Ket_Deus_Archoazh/c50a32c62dacaf1e613dc5f1b99107f9_0275190_0281220.mp3	Muioc'h-mui a brouennoù zo omp erruet e pikern produiñ tireoul ar bed, pe tost-kaer dezhañ.
Neus_Ket_Deus_Archoazh/c50a32c62dacaf1e613dc5f1b99107f9_0281100_0284850.mp3	Er bloavezhioù tri-ugent oa bet ar pikern diskuliañ tireoulegoù nevez.
Neus_Ket_Deus_Archoazh/c50a32c62dacaf1e613dc5f1b99107f9_0285990_0290760.mp3	Ouzhpenn daou-ugent vloaz war-lerc'h, n'haller ket diarbenn digresk an diskuliañ tireoulegoù nevez.
Neus_Ket_Deus_Archoazh/c50a32c62dacaf1e613dc5f1b99107f9_0293311_0298920.mp3	Peder bro hag hanter-kant diwar ar pemp ha tri-ugent a brodu tireoul zo erruet d'o fikern produiñ.
Neus_Ket_Deus_Archoazh/c50a32c62dacaf1e613dc5f1b99107f9_0300270_0303000.mp3	Kemend-all c'hoarvezo gant darn deus ar re all a-raok pell.
Neus_Ket_Deus_Archoazh/c50a32c62dacaf1e613dc5f1b99107f9_0304980_0313230.mp3	Ret e vo kavet ar memes kementad a energiezh hag an tireoul produet e Arabia Saoudat bep tri bloaz evit goloiñ war divigañ an tireoulegoù zo deus outo hiziv.
Neus_Ket_Deus_Archoazh/c50a32c62dacaf1e613dc5f1b99107f9_0315180_0319830.mp3	Er bloavezhioù tri-ugent veze eztennet c'hwec'h barrikennad tireoul pa veze implijet unan.
Neus_Ket_Deus_Archoazh/c50a32c62dacaf1e613dc5f1b99107f9_0320401_0325680.mp3	daou-ugent vloaz war-lerc'h e vez implijet etre tri ha c'hwec'h barrikennad er bed pa vez eztennet unan.
Neus_Ket_Deus_Archoazh/c50a32c62dacaf1e613dc5f1b99107f9_0328020_0336840.mp3	Ur wech pa vo bet tizhet ar pikern er produiñ tireoul er bed e vo kalz brasoc'h ar goulenn evit ar c'hinnig, ha kemmoù bras a vo ingal e priz an esañs.
Neus_Ket_Deus_Archoazh/c50a32c62dacaf1e613dc5f1b99107f9_0337262_0340440.mp3	Mont a ray an efedoù kalz pelloc'h evit priz ur gibellad esañs.
Neus_Ket_Deus_Archoazh/c50a32c62dacaf1e613dc5f1b99107f9_0341220_0345120.mp3	Depantiñ a ra kêrioù bras hon marevezh deus an energiezhioù fosil.
Neus_Ket_Deus_Archoazh/c50a32c62dacaf1e613dc5f1b99107f9_0345330_0349620.mp3	Gant asfalt, tennet deus an tireoul, vez graet an hentoù. Toennoù ur bern tier ivez.
Neus_Ket_Deus_Archoazh/c50a32c62dacaf1e613dc5f1b99107f9_0350280_0355380.mp3	N'hallfer ket bevañ war dakadoù douar bras zo ma ne vijent ket tommet deus ar goañv ha yenaet deus an hañv.
Neus_Ket_Deus_Archoazh/c50a32c62dacaf1e613dc5f1b99107f9_0356070_0361589.mp3	Abalamour da lederezh ar c'hêrioù e ya an dud war gilometroù betek en o lec'h labour, en o skol, er stalioù.
Neus_Ket_Deus_Archoazh/c50a32c62dacaf1e613dc5f1b99107f9_0362010_0369270.mp3	Rannet eo ar c'hêrioù pennañ e takadoù annez ha takadoù koñverzh pell an eil re deus ar re all, ha rediet an dud da vont ha da zont gant otoioù.
Neus_Ket_Deus_Archoazh/c50a32c62dacaf1e613dc5f1b99107f9_0370350_0376349.mp3	Savet eo bet ar banlev hag an tolpadoù-kêrioù evel ma oa didermen ar produiñ tireoul hag energiezhioù.
Neus_Ket_Deus_Archoazh/c50a32c62dacaf1e613dc5f1b99107f9_0379140_0385500.mp3	Ar produioù kimiek tennet deus an energiezhioù fosil, an eoul gimiezh, zo ur redi evit sevel a bep seurt produioù.
Neus_Ket_Deus_Archoazh/c50a32c62dacaf1e613dc5f1b99107f9_0387840_0395880.mp3	Stag-mat eo al labour-douar deus an energiezhioù fosil, dres evel an ospitalioù, ar c'hirri-nij, ar reizhiadoù dasparzh dour.
Neus_Ket_Deus_Archoazh/c50a32c62dacaf1e613dc5f1b99107f9_0396428_0401639.mp3	Mann nemet arme ar Stadoù-Unanet a ra gant kant daou-ugent milion barrikennad tireoul ar bloaz.
Neus_Ket_Deus_Archoazh/c50a32c62dacaf1e613dc5f1b99107f9_0402977_0411540.mp3	Ur redi eo an energiezhioù fosil evit sevel plastik ha polimeroù, elfennoù diazez an urzhiataerezoù, binvioù didu ha dilhad zo.
Neus_Ket_Deus_Archoazh/c50a32c62dacaf1e613dc5f1b99107f9_0412110_0417900.mp3	Stag eo ekonomiezh ar bed deus ur c'hresk difin, diazezet war gresk an energiezhioù marc'had mat.
Neus_Ket_Deus_Archoazh/c50a32c62dacaf1e613dc5f1b99107f9_0420720_0430170.mp3	Ken stag omp deus an tireoul ha deus an energiezhioù fosil all ken e talv ur c'hemm, ha pa vefe bihan, e kementad an energiezhioù eilefedoù spontus war hon buhez pemdez.
Neus_Ket_Deus_Archoazh/c50a32c62dacaf1e613dc5f1b99107f9_0441988_0445020.mp3	Talv a ra an energiezh ar varregezh da gas ul labour da benn vat. <SONEREZH>
Neus_Ket_Deus_Archoazh/c50a32c62dacaf1e613dc5f1b99107f9_0445680_0450330.mp3	Nerzh kant hanter-kant sklav o labourat noz-deiz a zo e kerzh un Amerikan boutin hiziv.
Neus_Ket_Deus_Archoazh/c50a32c62dacaf1e613dc5f1b99107f9_0453450_0456360.mp3	Treloskoù vez graet deus an danvez a zalc'h an nerzh-se.
Neus_Ket_Deus_Archoazh/c50a32c62dacaf1e613dc5f1b99107f9_0458340_0461040.mp3	Muioc'h a nerzh a zo e treloskoù zo evit er re all.
Neus_Ket_Deus_Archoazh/c50a32c62dacaf1e613dc5f1b99107f9_0461310_0467160.mp3	Douester an energiezh a vez graet deus se. Gant an tireoul, un deus an treloskoù-se, emañ an dalc'h.
Neus_Ket_Deus_Archoazh/c50a32c62dacaf1e613dc5f1b99107f9_0467791_0472548.mp3	tregont miliard barrikennad ar bloaz vez implijet gant an dud er bed, da lavaret eo daou zevezh-arat kub ha tregont a direoul,
Neus_Ket_Deus_Archoazh/c50a32c62dacaf1e613dc5f1b99107f9_0474540_0481830.mp3	pe talvoudegezh an energiezh a vije produet gant div greizenn nukleel ha hanter-kant o vont en-dro ingal en hanter-kant vloavezh da zont.
Neus_Ket_Deus_Archoazh/c50a32c62dacaf1e613dc5f1b99107f9_0482160_0490349.mp3	Daoust ma ne zeu nemet un dre gant pik c'hwec'h deus tredan Amerika diwar an tireoul ec'h a da voueta c'hwezek dre gant ha pevar-ugent deus an dougen-samm.
Neus_Ket_Deus_Archoazh/c50a32c62dacaf1e613dc5f1b99107f9_0491220_0504630.mp3	E daou vil eizh eo an div drederenn deus tireoul Amerika oa bet enporzhiet, deus ar C'hanada peurvuiañ, Mec'hiko, Arabia Saoudat, Venezuela, Nijeria, Irak hag Angola.
Neus_Ket_Deus_Archoazh/c50a32c62dacaf1e613dc5f1b99107f9_0506430_0510620.mp3	N'eus ket par d'an tireoul evit meur a abeg : e zouester energiezh da gentañ.
Neus_Ket_Deus_Archoazh/c50a32c62dacaf1e613dc5f1b99107f9_0511740_0515549.mp3	Talvoudegezh tost da teir bloavezh labour un den zo en ur varrikennad tireoul.
Neus_Ket_Deus_Archoazh/c50a32c62dacaf1e613dc5f1b99107f9_0517559_0522870.mp3	Dourek vez d'ur wrez etre, aezet eo kas-degas anezhañ, hag implij anezhañ e kefluskerioù bihan.
Neus_Ket_Deus_Archoazh/c50a32c62dacaf1e613dc5f1b99107f9_0524700_0527730.mp3	Evit dastum energiezh zo ezhomm d'ober gant energiezh.
Neus_Ket_Deus_Archoazh/c50a32c62dacaf1e613dc5f1b99107f9_0528210_0532530.mp3	Ober gant nebeut a nerzh evit kavet hag eztennañ kalz a energiezh, aze mañ ar stek.
Neus_Ket_Deus_Archoazh/c50a32c62dacaf1e613dc5f1b99107f9_0535560_0540660.mp3	Gounid Energiezh War an Energiezh Postet (GEWEP) eo se. EROEI en saozneg.
Neus_Ket_Deus_Archoazh/c50a32c62dacaf1e613dc5f1b99107f9_0540900_0546960.mp3	Ur skouer vat eo an tireoul boutin. Da gentañ oa bet eztennet an tireoul kriz, a galite hag an aesañ.
Neus_Ket_Deus_Archoazh/c50a32c62dacaf1e613dc5f1b99107f9_0548040_0556654.mp3	Ur varrikennad tireoul veze implijet evit kavet hag eztennañ kant barrikennad all. <SONEREZH>
Neus_Ket_Deus_Archoazh/c50a32c62dacaf1e613dc5f1b99107f9_0558330_0566760.mp3	Pa oa bet eztennet an tireoul aes da gavet da gentañ oa bet ret mont da glask mammennoù en uhelvorioù, pe e broioù pell, en ur implij kalzig a energiezh.
Neus_Ket_Deus_Archoazh/c50a32c62dacaf1e613dc5f1b99107f9_0568590_0573720.mp3	Ponner pe sulfurus vez alies an tireoul kavet mod-se, ha koust' ra ker puraat anezhañ.
Neus_Ket_Deus_Archoazh/c50a32c62dacaf1e613dc5f1b99107f9_0574680_0577650.mp3	Ken izel ha dek eo GEWEP an tireoul hiziv.
Neus_Ket_Deus_Archoazh/c50a32c62dacaf1e613dc5f1b99107f9_0579330_0585150.mp3	Ma vez graet gant muioc'h a energiezh evit eztennañ un trelosk evit ma zo barzh an trelosk-se, ne dalv ket ar boan.
Neus_Ket_Deus_Archoazh/c50a32c62dacaf1e613dc5f1b99107f9_0589140_0591600.mp3	Moaien zo da droiñ ur vammenn energiezh en un all.
Neus_Ket_Deus_Archoazh/c50a32c62dacaf1e613dc5f1b99107f9_0592470_0595919.mp3	Bewech ma vez graet vez koll war an nerzh a oa en trelosk kentañ.
Neus_Ket_Deus_Archoazh/c50a32c62dacaf1e613dc5f1b99107f9_0598110_0603060.mp3	Bez' zo tireoulioù n'int ket boutin, da skouer : ar sabron hag ar skiit terdouarek.
Neus_Ket_Deus_Archoazh/c50a32c62dacaf1e613dc5f1b99107f9_0603540_0610109.mp3	Er C'hanada vez kavet darn deus ar sabron terdouarek. Er Stadoù-Unanet mañ an div drederenn deus skiit terdouarek ar bed.
Neus_Ket_Deus_Archoazh/c50a32c62dacaf1e613dc5f1b99107f9_0610380_0613950.mp3	Moaien zo da droiñ an daou drelosk-se e tireoul boutin kenaozet.
Neus_Ket_Deus_Archoazh/c50a32c62dacaf1e613dc5f1b99107f9_0614070_0621525.mp3	Na vit-se vez ezhomm deus kalz a wrez hag a zour fresk, ent-se vez digresket o GEWEP a c'hall mont deus pemp da un pik pemp.
Neus_Ket_Deus_Archoazh/c50a32c62dacaf1e613dc5f1b99107f9_0623835_0631605.mp3	Trelosk paour hardizh eo ar skiit tredouarek zo ennañ un drederenn, evit ar memes pouez, deus an nerzh zo ba ur voestad edaj evit an dijuni.
Neus_Ket_Deus_Archoazh/c50a32c62dacaf1e613dc5f1b99107f9_0632445_0636495.mp3	Bernioù bras a c'hlaou a zo a bourvez ar bed gant un hanter deus e dredan.
Neus_Ket_Deus_Archoazh/c50a32c62dacaf1e613dc5f1b99107f9_0637215_0641204.mp3	Tost da tri-ugent devezh-arat kub glaou ar bloaz vez implijet er bed.
Neus_Ket_Deus_Archoazh/c50a32c62dacaf1e613dc5f1b99107f9_0641715_0646965.mp3	Padal c'hallfer erruout da bikern produiñ hollek ar glaou a-raok daou vil daou-ugent.
Neus_Ket_Deus_Archoazh/c50a32c62dacaf1e613dc5f1b99107f9_0647775_0654465.mp3	Ur fazi eo krediñ pado ar glaou kantvedoù en Amerika, pa ne vez ket taolet e kont e kresk ar goulenn, hag e tigresk e galite.
Neus_Ket_Deus_Archoazh/c50a32c62dacaf1e613dc5f1b99107f9_0655815_0662055.mp3	Darn deus ar glaou karreg, a galite vat, zo aet da get, ha ne chom nemet glaou a galite izeloc'h, nebeutoc'h a nerzh ennañ.
Neus_Ket_Deus_Archoazh/c50a32c62dacaf1e613dc5f1b99107f9_0663075_0669435.mp3	Trubuilhoù produiñ a sav neuze, p'eo bet eztennet glaou ar c'horre dija, ha ret vez toullañ donoc'h, e lec'hioù diaesoc'h da vont enno.
Neus_Ket_Deus_Archoazh/c50a32c62dacaf1e613dc5f1b99107f9_0670575_0675735.mp3	A-wechoù memes vez diskaret menezioù evit kavet ar bernioù glaou, hag un drast spontus eo evit an natur.
Neus_Ket_Deus_Archoazh/c50a32c62dacaf1e613dc5f1b99107f9_0679245_0682515.mp3	Da heul an tireoul hag ar glaou vez kavet gaz naturel alies.
Neus_Ket_Deus_Archoazh/c50a32c62dacaf1e613dc5f1b99107f9_0683475_0690795.mp3	Er bloavezhioù hanter-kant zo bet pikern diskuliañ gaz naturel en Amerika an Hanternoz, hag e penn-kentañ ar bloavezhioù dek ha tri-ugent, pikern ar produiñ.
Neus_Ket_Deus_Archoazh/c50a32c62dacaf1e613dc5f1b99107f9_0691305_0698385.mp3	Ma vo kaset tres-kromm an diskuliañ tri bloaz warn-ugent pelloc'h e weler splann dazont ar produiñ gaz naturel en Amerika an Hanternoz.
Neus_Ket_Deus_Archoazh/c50a32c62dacaf1e613dc5f1b99107f9_0700335_0709395.mp3	A-drugarez da deknikoù nevez c'haller eztennañ gaz naturel divoutin evel ar gaz skiit, a vo, marteze, ur rikour e-tal diskar ar produiñ er bloavezhioù da zont.
Neus_Ket_Deus_Archoazh/c50a32c62dacaf1e613dc5f1b99107f9_0710415_0716535.mp3	Disputet eo talvoudegezh ar gaz divoutin, pa zo ezhomm vefe uhel prizioù an energiezhioù evit ma vefe ampletus.
Neus_Ket_Deus_Archoazh/c50a32c62dacaf1e613dc5f1b99107f9_0718575_0723795.mp3	Memes en ur gontañ ar gaz divoutin c'hallfer erruout d'ar pikern produiñ gaz er bed e daou vil tregont.
Neus_Ket_Deus_Archoazh/c50a32c62dacaf1e613dc5f1b99107f9_0727035_0730065.mp3	Bez' zo bernioù uraniom bras, a dalv d'ar skiriañ nukleel.
Neus_Ket_Deus_Archoazh/c50a32c62dacaf1e613dc5f1b99107f9_0730995_0737265.mp3	Evit produiñ an dek terawatt a vez tennet deus an energiezhioù fosil vije ezhomm deus dek mil kreizenn nukleel,
Neus_Ket_Deus_Archoazh/c50a32c62dacaf1e613dc5f1b99107f9_0737596_0741645.mp3	ha n'hallfe padet ar bernioù uraniom ouiomp zo anezho nemet dek pe ugent vloaz.
Neus_Ket_Deus_Archoazh/c50a32c62dacaf1e613dc5f1b99107f9_0746085_0752295.mp3	Taolioù-arnod zo bet graet gant reaktorioù dreistganerioù dre blutoniom en Frañs ha Japan, c'hwitadennoù koustus anezho.
Neus_Ket_Deus_Archoazh/c50a32c62dacaf1e613dc5f1b99107f9_0753825_0757125.mp3	Skoilhoù teknikel ramz zo war hent ar skiriañ nukleel.
Neus_Ket_Deus_Archoazh/c50a32c62dacaf1e613dc5f1b99107f9_0758175_0760245.mp3	An nerzhioù neveshaüs zo deus outo ivez.
Neus_Ket_Deus_Archoazh/c50a32c62dacaf1e613dc5f1b99107f9_0760695_0763725.mp3	Ur GEWEP uhel 'n deus nerzh an avel, met paouez-dibaouez eo.
Neus_Ket_Deus_Archoazh/c50a32c62dacaf1e613dc5f1b99107f9_0765105_0770715.mp3	War nerzh an dour c'haller kontañ, met savet zo bet stankelloù war al lodenn vrasañ deus stêrioù ar bed diorroet.
Neus_Ket_Deus_Archoazh/c50a32c62dacaf1e613dc5f1b99107f9_0771645_0776985.mp3	Ar c'hreizennoù gwrez-douar boutin a denn o nerzh deus takadoù tomm tost da c'horre an Douar.
Neus_Ket_Deus_Archoazh/c50a32c62dacaf1e613dc5f1b99107f9_0776985_0778635.mp3	Stag int deus an takadoù-se.
Neus_Ket_Deus_Archoazh/c50a32c62dacaf1e613dc5f1b99107f9_0778425_0785445.mp3	Er c'hreizennoù gwrez-douar gwellaet hag arnodiñ vez toullet daou riboul dek kilometr en douar.
Neus_Ket_Deus_Archoazh/c50a32c62dacaf1e613dc5f1b99107f9_0786165_0791745.mp3	Kaset vez dour en eil riboul, a vez tommet er frailhoù, ha pompet er riboul all evit produiñ tredan.
Neus_Ket_Deus_Archoazh/c50a32c62dacaf1e613dc5f1b99107f9_0792705_0800835.mp3	Hervez ur rentañ-kont nevez a-walc'h gant an MIT e tegasfe an teknologiezh-se dek dre gant deus tredan ar Stadoù-Unanet ac'han daou vil hanter-kant.
Neus_Ket_Deus_Archoazh/c50a32c62dacaf1e613dc5f1b99107f9_0801975_0804495.mp3	Nerzh ar gwagennoù ne vez produet nemet war an aodoù.
Neus_Ket_Deus_Archoazh/c50a32c62dacaf1e613dc5f1b99107f9_0805275_0808483.mp3	Disheñvel eo douester energiezh ar gwagennoù hervez ar broioù.
Neus_Ket_Deus_Archoazh/c50a32c62dacaf1e613dc5f1b99107f9_0809925_0813075.mp3	Un dael vije kas tredan produet gant ar gwagennoù barzh an douaroù.
Neus_Ket_Deus_Archoazh/c50a32c62dacaf1e613dc5f1b99107f9_0814335_0817844.mp3	Ouzhpenn-se vez krignet an troellrodoù gant aer ha dour ar mor.
Neus_Ket_Deus_Archoazh/c50a32c62dacaf1e613dc5f1b99107f9_0820035_0822255.mp3	An treloskoù bev zo treloskoù gounezet.
Neus_Ket_Deus_Archoazh/c50a32c62dacaf1e613dc5f1b99107f9_0822795_0825884.mp3	Izel eo douester energiezh ar c'hoad, ha kreskiñ a ra difonn.
Neus_Ket_Deus_Archoazh/c50a32c62dacaf1e613dc5f1b99107f9_0826275_0829935.mp3	Tost da tri-ugent devezh-arat koad ar bloaz vez implijet er bed.
Neus_Ket_Deus_Archoazh/c50a32c62dacaf1e613dc5f1b99107f9_0831195_0835755.mp3	Dont ra ar gazeoul bev hag an etanol deus ul labour-douar stag deus nerzh an tireoul.
Neus_Ket_Deus_Archoazh/c50a32c62dacaf1e613dc5f1b99107f9_0836745_0839565.mp3	Izel-kaer eo ar gounid nerzh war an treloskoù-se.
Neus_Ket_Deus_Archoazh/c50a32c62dacaf1e613dc5f1b99107f9_0840855_0844215.mp3	Faot' a rafe da bolitikerien zo troiñ ar mais en etanol.
Neus_Ket_Deus_Archoazh/c50a32c62dacaf1e613dc5f1b99107f9_0844815_0853155.mp3	Ober gant etanol evit pourchas un dekvedenn deus an esañs vo ezhomm er Stadoù-Unanet en daou vil ugent talvezfe implij tri dre gant deus douaroù Amerika.
Neus_Ket_Deus_Archoazh/c50a32c62dacaf1e613dc5f1b99107f9_0853815_0858465.mp3	Pourchas un drederenn dalvezfe ober gant teir gwech an douaroù gounid mais.
Neus_Ket_Deus_Archoazh/c50a32c62dacaf1e613dc5f1b99107f9_0859185_0865755.mp3	Evit pourchas an tireoul a vo ezhomm anezhañ en Amerika en daou vil ugent vije ezhomm deus un hanter muioc'h douaroù gounid boued.
Neus_Ket_Deus_Archoazh/c50a32c62dacaf1e613dc5f1b99107f9_0868845_0875805.mp3	Eztennet vez an hidrojen deus ar gaz naturel, ar glaou pe an dour, ha graet vez gant muioc'h a nerzh evit ar pezh vez dastumet.
Neus_Ket_Deus_Archoazh/c50a32c62dacaf1e613dc5f1b99107f9_0876646_0879765.mp3	Kazi sur ne vo ket diazezet an ekonomiezh war an hidrojen.
Neus_Ket_Deus_Archoazh/c50a32c62dacaf1e613dc5f1b99107f9_0881595_0887144.mp3	Kement ha div greizenn gwrez diwar c'hlaou e talv produiñ tredan holl banelloù fotovoltaek ar bed.
Neus_Ket_Deus_Archoazh/c50a32c62dacaf1e613dc5f1b99107f9_0888435_0892725.mp3	Etre unan ha peder tonenn glaou vez implijet evit ober ur banell fotovoltaek.
Neus_Ket_Deus_Archoazh/c50a32c62dacaf1e613dc5f1b99107f9_0895635_0903345.mp3	Ret vije goloiñ ur c'horread daou c'hant mil pevar c'hilometr karrez warn-ugent gant panelloù evit pourchas an energiezh zo ezhomm anezhañ er bed.
Neus_Ket_Deus_Archoazh/c50a32c62dacaf1e613dc5f1b99107f9_0903435_0907455.mp3	E daou vil seizh e oa goloet ur c'hwec'h pik pemp kilometr karrez bennak.
Neus_Ket_Deus_Archoazh/c50a32c62dacaf1e613dc5f1b99107f9_0908085_0912045.mp3	Barregezhioù bras o deus ar c'hreizennoù gwrez-heol, met nebeut-kaer zo deus outo.
Neus_Ket_Deus_Archoazh/c50a32c62dacaf1e613dc5f1b99107f9_0912623_0921555.mp3	N'haller sevel anezho nemet lec'h ma vez heol ingal, ha ret vez kas kementadoù bras a dredan war hirderioù ken bras all.
Neus_Ket_Deus_Archoazh/c50a32c62dacaf1e613dc5f1b99107f9_0924555_0929355.mp3	Stag eo an holl energiezhioù erlec'hiañ-se da vekanikoù ac'h a en-dro gant tireoul,
Neus_Ket_Deus_Archoazh/c50a32c62dacaf1e613dc5f1b99107f9_0929685_0932715.mp3	pe o dez ezhomm deus danvez evel ar plastik, a vez graet gant tireoul.
Neus_Ket_Deus_Archoazh/c50a32c62dacaf1e613dc5f1b99107f9_0934815_0939735.mp3	Pa vez tud oc'h embann o deus treloskoù pe vekanikoù burzhudus, dav goull ganto :
Neus_Ket_Deus_Archoazh/c50a32c62dacaf1e613dc5f1b99107f9_0940155_0942855.mp3	ur skouerenn deus ar mekanik ac'h a en-dro o deus an dud-se ?
Neus_Ket_Deus_Archoazh/c50a32c62dacaf1e613dc5f1b99107f9_0944625_0948795.mp3	Peseurt douester energiezh 'n eus ? Aes vez klenkañ pe skignañ anezhañ ?
Neus_Ket_Deus_Archoazh/c50a32c62dacaf1e613dc5f1b99107f9_0950205_0955245.mp3	Ur produiñ ingal pe paouez-dibaouez ? Moaien zo d'ober gantañ er vro a-bezh ?
Neus_Ket_Deus_Archoazh/c50a32c62dacaf1e613dc5f1b99107f9_0955815_0963195.mp3	Ha skoilhoù teknikel kuzh a vije ? Peseurt GEWEP en eus ? Peseurt efedoù war an endro ?
Neus_Ket_Deus_Archoazh/c50a32c62dacaf1e613dc5f1b99107f9_0964575_0972615.mp3	Touellet c'haller bezañ gant niveroù bras… Da skouer : ur miliard barrikennad tireoul a vo diouzh ezhomm daouzek devezh nemetken.
Neus_Ket_Deus_Archoazh/c50a32c62dacaf1e613dc5f1b99107f9_0974655_0977955.mp3	Klaoustre spontus vije tremen deus an energiezhioù fosil da reoù all.
Neus_Ket_Deus_Archoazh/c50a32c62dacaf1e613dc5f1b99107f9_0978795_0984610.mp3	E daou vil seizh zo bet produet eizh dre gant ha daou-ugent virgulenn pemp deus tredan ar Stadoù-Unanet diwar c'hlaou.
Neus_Ket_Deus_Archoazh/c50a32c62dacaf1e613dc5f1b99107f9_0984435_0989715.mp3	un dre gant warn-ugent virgulenn c'hwec'h diwar ar gaz naturel, un dre gant virgulenn c'hwec'h diwar an tireoul,
